level,text
C2,"Skyscrapers, cathedrals, and castles have always punctuated the skylines of the world's most venerable cities, standing as testaments to the ingenuity and ambition of humankind. From the ancient pyramids of Giza to the sprawling metropolises of today, the history of human civilization is intimately intertwined with the history of architecture.

In the beginning, people built simple structures out of necessity, using natural materials like wood, stone, and mud. These early dwellings provided shelter from the elements and protection from predators. Over time, as societies grew and prospered, the need for more complex and sophisticated structures arose.

Temples and palaces were built to honor gods and house royalty, while markets and amphitheaters served as bustling centers of commerce and entertainment. The ancient Greeks and Romans were particularly renowned for their architectural achievements, developing innovative techniques such as the use of arches, vaults, and domes.

The Middle Ages saw the rise of Gothic architecture, characterized by its soaring spires, intricate stained-glass windows, and ribbed vaults. This style reached its zenith in the construction of magnificent cathedrals, such as Notre Dame de Paris and Chartres Cathedral.

The Renaissance brought a renewed interest in classical architecture, with architects drawing inspiration from the ruins of ancient Rome. This period saw the construction of some of the world's most iconic buildings, including the Uffizi Gallery in Florence and the St. Peter's Basilica in Rome.

The Industrial Revolution ushered in a new era of architectural innovation, with the development of new materials such as steel and concrete. These materials allowed for the construction of taller and more daring structures, such as the Eiffel Tower in Paris and the Empire State Building in New York City.

In the 20th century, modern architecture emerged as a dominant force, characterized by its rejection of traditional forms and its emphasis on functionality. This style produced iconic buildings such as the Bauhaus Dessau in Germany and the Sydney Opera House in Australia.

Today, architecture continues to evolve, with new trends emerging all the time. Green architecture, which emphasizes sustainability and energy efficiency, is becoming increasingly popular. 3D printing is also revolutionizing the construction industry, allowing for the creation of complex and intricate structures that were previously impossible to build.

One thing is for sure: architecture will continue to play a vital role in shaping our world. From the humble hut to the towering skyscraper, buildings are not just structures; they are symbols of our culture, our history, and our aspirations."
C1,"In the heart of a bustling metropolis, where towering skyscrapers competed for attention with sprawling parks, stood a remarkable structure that embodied the essence of human endeavor and artistry. This architectural marvel was not merely a building; it was a canvas upon which the stories of countless lives unfolded.

From the ingenuity of its conception to the meticulous execution of its design, the edifice bore witness to the collaborative efforts of architects, engineers, and artisans. Each individual brought their unique talents and expertise to the table, weaving their skills together to create a masterpiece that would stand the test of time.

The foundation of the building was a testament to the strength and resilience of human spirit. Deep within the earth, workers toiled tirelessly, pouring concrete and steel into the framework that would support the colossal structure. With each pour, they laid the groundwork for a legacy that would endure for generations to come.

As the building rose skyward, floor by floor, a symphony of construction filled the air. The clang of hammers, the whine of drills, and the roar of machinery echoed through the streets, a testament to the tireless efforts of the construction crew. With each brick laid, each beam hoisted into place, the building took shape, transforming from a mere blueprint into a tangible reality.

Within the walls of this architectural marvel, a vibrant tapestry of human life began to emerge. From the hushed whispers of scholars in the library to the joyous laughter of children in the daycare center, the building hummed with activity. Each room held its own unique purpose, fostering connections, igniting creativity, and nurturing the dreams of those who passed through its doors.

In the grand lobby, a breathtaking mural adorned the walls, depicting scenes from the city's rich history. Artists painstakingly recreated moments of triumph, tragedy, and transformation, capturing the essence of a metropolis that was constantly evolving, reinventing itself with each passing era. The mural served as a reminder that the building itself was part of a larger narrative, a chapter in the ongoing story of human civilization.

With the completion of the structure, the building was finally ready to welcome its inhabitants. Tenants from all walks of life streamed through the doors, eager to start a new chapter in their own personal journeys. Young professionals found solace in the co-working spaces, surrounded by like-minded individuals chasing their dreams. Families relished the convenience of living in a building that offered everything they needed under one roof, from a state-of-the-art gym to a rooftop garden.

As the sun set, casting a golden glow on the cityscape, the building stood as a beacon of hope and possibility. Its lights twinkled like stars against the darkening sky, a symbol of the endless potential that lies within human collaboration and ingenuity. The building, as a testament to human ambition, would continue to witness countless stories unfold within its walls, shaping the lives of its inhabitants and leaving an indelible mark on the tapestry of the city."
B2,"People have always been constructing edifices for various reasons. One of our basic needs is shelter from the elements, which is why we construct homes to keep ourselves warm and dry. However, our needs go beyond basic survival; we seek entertainment and cultural enrichment. That's where stadiums and museums come in. In stadiums, we gather to cheer on our favorite sports teams or enjoy the electrifying atmosphere of a concert. Museums, on the other hand, serve as repositories of our collective heritage, showcasing beautiful and awe-inspiring works of art and history.

Creating these structures requires the collaboration of numerous individuals, each contributing their expertise and labor. Architects, with their creative vision, design the blueprints that bring these edifices to life. Engineers, with their technical prowess, ensure that these designs are structurally sound and practical. Skilled construction workers, using their hands and tools, transform these plans into tangible reality.

Throughout history, remarkable buildings have left an indelible mark on our collective consciousness. The Great Pyramids of Giza, built thousands of years ago, still astound us with their sheer size and architectural ingenuity. The Roman Colosseum, with its iconic elliptical shape, has borne witness to countless gladiatorial contests and public spectacles. And who can forget the Eiffel Tower, a symbol of French engineering prowess that has become synonymous with the Parisian skyline?

In modern times, the construction industry has become increasingly sophisticated, incorporating innovative technologies and sustainable materials. From skyscrapers that pierce the clouds to eco-friendly structures that blend seamlessly into their natural surroundings, our built environment is constantly evolving.

As our needs and aspirations change, so too will the buildings we create. The future holds exciting possibilities, with architects and engineers pushing the boundaries of design and functionality, creating structures that are both visually stunning and environmentally responsible. These edifices will not only serve as landmarks of our time but also shape the way we live, work, and interact with the world around us."
B1,"In a bustling metropolis, where dreams took shape and ambitions soared, nestled a marvel of human ingenuity: a magnificent skyscraper. Its steel skeleton reached towards the heavens, adorned with gleaming glass panels that reflected the vibrant city below. Within this architectural masterpiece, a symphony of human endeavor unfolded.

Architects, with their visionary minds, meticulously crafted the blueprint, ensuring every angle and curve harmonized perfectly. Engineers, with their technical prowess, calculated the weight distribution, ensuring the structure would stand steadfast against the relentless forces of nature. Construction workers, with their skilled hands, tirelessly assembled each component, their camaraderie echoing through the skeletal frame.

As the skyscraper grew, it attracted the attention of curious onlookers. They marveled at the sheer scale of the project, the intricate details that adorned its facade, and the sheer determination of those who labored tirelessly to bring it to life. Among them was a young girl named Emma, whose heart skipped a beat as she gazed upon this architectural wonder.

Within the skyscraper's vast interior, a vibrant ecosystem of human activity thrived. Office workers scurried about, their footsteps echoing through the polished marble floors as they attended meetings, collaborated on projects, and fueled the economic engine of the city. Artists displayed their masterpieces in the expansive galleries, their creativity adding a touch of whimsy and wonder to the corporate landscape.

Emma, driven by an insatiable curiosity, decided to explore the inner workings of this architectural behemoth. She discovered a hidden world of mechanical marvels: elevators gliding effortlessly between floors, intricate ventilation systems ensuring a constant flow of fresh air, and state-of-the-art security systems safeguarding the building and its occupants.

In the heart of the skyscraper, she stumbled upon a group of architects and engineers, their faces etched with both exhaustion and exhilaration. They shared stories of challenges overcome, innovations implemented, and the deep sense of satisfaction that came from witnessing their creation take shape.

As Emma left the skyscraper, her heart swelled with pride and inspiration. She realized that this magnificent structure was more than just a building; it was a symbol of human ingenuity, collaboration, and the relentless pursuit of progress. And in that moment, she knew that she wanted to be a part of it all, to contribute her own talents and creativity to the ever-evolving skyline of her beloved city."
A2,"People have always built structures. We require homes to keep us warm and dry, and we erect stadiums so that we can enjoy football games and musical performances. Furthermore, we utilize structures such as museums to shelter beautiful objects. A diverse group of individuals collaborate to construct a building.

The architect drafts the blueprints, which serve as a guide for the construction process. The builders, who possess the necessary skills and knowledge, meticulously erect the structure. They begin by pouring the foundation, which provides stability and support to the edifice. Subsequently, they construct the framework, which forms the skeletal structure of the building. Bricks, concrete, and other materials are skillfully combined to create the walls, which enclose and define the interior spaces. The roof, which protects the building from the elements, is painstakingly installed.

A plethora of individuals contributes to the successful completion of a building project. Engineers ensure the structural integrity of the edifice, while interior designers meticulously plan the layout and aesthetics of the interior spaces. Electricians skillfully wire the building, illuminating its corridors and rooms. Plumbers install the necessary pipes and fixtures, ensuring a steady flow of water throughout the structure.

When the construction process draws to a close, painters apply vibrant hues to the walls, enhancing the visual appeal of the building. Landscapers meticulously design and cultivate the surrounding grounds, creating a harmonious and inviting environment. Finally, cleaners meticulously remove any debris or residue, leaving the building spotless and ready for occupation.

Buildings stand as testaments to human ingenuity and collaboration. They provide shelter, serve a multitude of purposes, and enhance the aesthetic appeal of our surroundings. The next time you enter a building, take a moment to appreciate the countless individuals who have dedicated their skills and efforts to its creation."
A1,"Once upon a time, in a bustling city, there lived a little girl named Lily. She was fascinated by all the tall buildings that reached towards the sky. One day, she decided to ask her grandmother about them.

""Grandma,"" she inquired, ""how do people create such magnificent buildings?""

The grandmother smiled and began to narrate, ""Well, Lily, building a house requires many workers. First, the architects design the plans on paper. Then, the builders gather the materials, like bricks and wood. They mix cement and carefully place each brick one by one.""

Lily listened with wide-eyed wonder as her grandmother described the process. She learned that the workers worked together, using their skills and strength to create a sturdy structure.

""But Grandma,"" Lily asked, ""why do we build so many different kinds of buildings?""

""That's a great question, Lily,"" replied her grandmother. ""We have houses to keep us warm and comfortable. We build schools so that children can learn and grow. We construct hospitals to care for the sick. And we create stadiums so that we can enjoy sports and concerts.""

As the sun began to set, Lily's curiosity was satisfied. She understood that buildings were not just made of bricks and mortar, but were also built with the hard work and cooperation of many people. From that day on, she looked at every building with a newfound appreciation."
